{
  "schema_version": "p0-melete-bridge/v1",
  "melete_source_commit": "9a3564dd96de22d0311522417c2c36e6bf2a0a91",
  "fixture_data_status": "synthetic_contract_inputs",
  "runtime_execution_status": "not_run",
  "cases": [
    {
      "case_id": "stored_without_materialized_memory",
      "expected_decision": "source_persisted_but_no_memory_id_no_search_claim",
      "allowed_unknown_reasons": ["no_memory_id_in_receipt", "extraction_result_unreported"],
      "required_capability": "melete_receipt_parser_and_dse_state_ledger",
      "expected_execution_permission": "not_applicable",
      "request_kind": "receipt_review",
      "expected_candidate_visibility": "not_confirmed",
      "inputs": {
        "simulation_requested": false,
        "source_binding": {"event_id": "evt-001", "root_event_id": "evt-001", "payload_sha256": "aaaaaaaaaaaaaaaaaaaaaaaaaaaaaaaaaaaaaaaaaaaaaaaaaaaaaaaaaaaaaaaa"},
        "receipt": {"event_id": "evt-001", "status": "stored", "gate_label": "informative", "memory_revision": 4, "journal_seq": 31, "memory_ids": [], "extraction_incomplete": false, "embedding_pending": false}
      },
      "runtime_observation": {"state": "not_run", "actual_receipt": null, "actual_readout": null}
    },
    {
      "case_id": "duplicate_is_not_independent_evidence",
      "expected_decision": "duplicate_resolves_to_prior_event_and_adds_zero_evidence",
      "allowed_unknown_reasons": [],
      "required_capability": "idempotency_ledger_keyed_by_scope_event_id_and_digest",
      "expected_execution_permission": "not_applicable",
      "request_kind": "receipt_review",
      "expected_candidate_visibility": "not_confirmed",
      "inputs": {
        "simulation_requested": false,
        "source_binding": {"event_id": "evt-002", "root_event_id": "evt-002", "payload_sha256": "bbbbbbbbbbbbbbbbbbbbbbbbbbbbbbbbbbbbbbbbbbbbbbbbbbbbbbbbbbbbbbbb", "duplicate_of_event_id": "evt-002"},
        "receipt": {"event_id": "evt-002", "status": "duplicate", "gate_label": "informative", "memory_revision": 5, "journal_seq": 32, "memory_ids": ["mem-22"], "extraction_incomplete": false, "embedding_pending": false}
      },
      "runtime_observation": {"state": "not_run", "actual_receipt": null, "actual_readout": null}
    },
    {
      "case_id": "trace_only_event_is_not_a_memory_candidate",
      "expected_decision": "trace_event_persisted_without_retrievable_memory_id",
      "allowed_unknown_reasons": ["no_memory_id_in_receipt"],
      "required_capability": "preserve_trace_event_separately_from_memory_claims",
      "expected_execution_permission": "not_applicable",
      "request_kind": "receipt_review",
      "expected_candidate_visibility": "not_confirmed",
      "inputs": {
        "simulation_requested": false,
        "source_binding": {"event_id": "evt-003", "root_event_id": "evt-003", "payload_sha256": "cccccccccccccccccccccccccccccccccccccccccccccccccccccccccccccccc"},
        "receipt": {"event_id": "evt-003", "status": "trace_only", "gate_label": "trace_only", "memory_revision": 5, "journal_seq": 33, "memory_ids": [], "extraction_incomplete": false, "embedding_pending": false}
      },
      "runtime_observation": {"state": "not_run", "actual_receipt": null, "actual_readout": null}
    },
    {
      "case_id": "incomplete_extraction_blocks_episode_use",
      "expected_decision": "candidate_memory_retained_but_incomplete_extraction_denies_execution",
      "allowed_unknown_reasons": ["extraction_incomplete", "required_evidence_incomplete"],
      "required_capability": "dse_evidence_completeness_gate_before_episode_validation",
      "expected_execution_permission": "denied",
      "request_kind": "episode_validation",
      "expected_candidate_visibility": "not_confirmed",
      "inputs": {
        "simulation_requested": true,
        "source_binding": {"event_id": "evt-004", "root_event_id": "evt-004", "payload_sha256": "dddddddddddddddddddddddddddddddddddddddddddddddddddddddddddddddd"},
        "receipt": {"event_id": "evt-004", "status": "stored", "gate_label": "informative", "memory_revision": 6, "journal_seq": 34, "memory_ids": ["mem-23"], "extraction_incomplete": true, "embedding_pending": false}
      },
      "runtime_observation": {"state": "not_run", "actual_receipt": null, "actual_readout": null}
    },
    {
      "case_id": "pending_embedding_does_not_establish_or_preclude_visibility",
      "expected_decision": "exact_fresh_query_hit_confirms_visibility_despite_pending_embedding_flag",
      "allowed_unknown_reasons": ["embedding_state_is_not_retrieval_evidence"],
      "required_capability": "authorized_fresh_text_query_and_exact_memory_version_match",
      "expected_execution_permission": "not_applicable",
      "request_kind": "receipt_review",
      "expected_candidate_visibility": "confirmed_visible",
      "inputs": {
        "simulation_requested": false,
        "source_binding": {"event_id": "evt-005", "root_event_id": "evt-005", "payload_sha256": "eeeeeeeeeeeeeeeeeeeeeeeeeeeeeeeeeeeeeeeeeeeeeeeeeeeeeeeeeeeeeeee"},
        "receipt": {"event_id": "evt-005", "status": "stored", "gate_label": "informative", "memory_revision": 7, "journal_seq": 35, "memory_ids": ["mem-24"], "extraction_incomplete": false, "embedding_pending": true, "embedding_failure_reason": "encoder_error"},
        "query_binding": {"request": {"query_id": "qry-5", "task_id": "task-5", "goal": "retrieve DSE episode evidence", "scope": {"user_id": "dse-user", "namespace": "dse"}, "context": {"gpu_family": "B300"}, "payload_kind": "text", "payload_sha256": "aaaaaaaaaaaaaaaaaaaaaaaaaaaaaaaaaaaaaaaaaaaaaaaaaaaaaaaaaaaaaaaa", "request_sha256": "aaaaaaaaaaaaaaaaaaaaaaaaaaaaaaaaaaaaaaaaaaaaaaaaaaaaaaaaaaaaaaaa", "mode": "index", "return_format": "text", "time_mode": "current"}, "authorization_witness": {"provider": "host_auth_boundary", "decision": "allow", "host_principal_ref": "principal:dse-user", "auth_scope_ref": {"owner_id": "owner-dse", "namespace": "dse", "learner_id": "learner-dse"}, "resolved_melete_scope": {"user_id": "dse-user", "namespace": "dse"}, "actor": "user", "query_id": "qry-5", "evidence_ref": "authz-evidence:qry-5"}, "expected_result": {"memory_id": "mem-24", "version": 1}, "expected_snapshot_seq": 35},
        "readout": {"retrieval_id": "ret-5", "query_id": "qry-5", "scope": {"user_id": "dse-user", "namespace": "dse"}, "snapshot_seq": 35, "items": [{"memory_id": "mem-24", "version": 1, "role": "episode", "applicability": {"gpu_family": "B300"}, "epistemic_state": "observed", "residency": "active"}]}
      },
      "runtime_observation": {"state": "not_run", "actual_receipt": null, "actual_readout": null}
    },
    {
      "case_id": "external_embedding_recovery_requires_fresh_query",
      "expected_decision": "external_recovery_is_counted_only_after_fresh_exact_query_hit",
      "allowed_unknown_reasons": [],
      "required_capability": "external_embedding_recovery_worker_plus_authorized_fresh_query",
      "expected_execution_permission": "not_applicable",
      "request_kind": "receipt_review",
      "expected_candidate_visibility": "confirmed_visible",
      "inputs": {
        "simulation_requested": false,
        "source_binding": {"event_id": "evt-006", "root_event_id": "evt-006", "payload_sha256": "ffffffffffffffffffffffffffffffffffffffffffffffffffffffffffffffff"},
        "receipt": {"event_id": "evt-006", "status": "stored", "gate_label": "informative", "memory_revision": 8, "journal_seq": 36, "memory_ids": ["mem-25"], "extraction_incomplete": false, "embedding_pending": true, "embedding_failure_reason": "encoder_error"},
        "embedding_recovery": {"owner": "external_worker", "outcome": "recovered", "fresh_query_hit": true},
        "query_binding": {"request": {"query_id": "qry-6", "task_id": "task-6", "goal": "verify recovered DSE memory visibility", "scope": {"user_id": "dse-user", "namespace": "dse"}, "context": {"gpu_family": "B300"}, "payload_kind": "text", "payload_sha256": "bbbbbbbbbbbbbbbbbbbbbbbbbbbbbbbbbbbbbbbbbbbbbbbbbbbbbbbbbbbbbbbb", "request_sha256": "bbbbbbbbbbbbbbbbbbbbbbbbbbbbbbbbbbbbbbbbbbbbbbbbbbbbbbbbbbbbbbbb", "mode": "index", "return_format": "text", "time_mode": "current"}, "authorization_witness": {"provider": "host_auth_boundary", "decision": "allow", "host_principal_ref": "principal:dse-user", "auth_scope_ref": {"owner_id": "owner-dse", "namespace": "dse", "learner_id": "learner-dse"}, "resolved_melete_scope": {"user_id": "dse-user", "namespace": "dse"}, "actor": "user", "query_id": "qry-6", "evidence_ref": "authz-evidence:qry-6"}, "expected_result": {"memory_id": "mem-25", "version": 1}, "expected_snapshot_seq": 38},
        "readout": {"retrieval_id": "ret-6", "query_id": "qry-6", "scope": {"user_id": "dse-user", "namespace": "dse"}, "snapshot_seq": 38, "items": [{"memory_id": "mem-25", "version": 1, "role": "pattern", "applicability": {"gpu_family": "B300"}, "epistemic_state": "candidate", "residency": "active"}]}
      },
      "runtime_observation": {"state": "not_run", "actual_receipt": null, "actual_readout": null}
    },
    {
      "case_id": "range_predicate_is_evaluated_by_dse_authority",
      "expected_decision": "dse_range_predicate_matches_after_exact_scalar_hint_candidate_retrieval",
      "allowed_unknown_reasons": [],
      "required_capability": "versioned_dse_predicate_resolver_and_current_design_snapshot",
      "expected_execution_permission": "not_applicable",
      "request_kind": "memory_apply",
      "expected_candidate_visibility": "confirmed_visible",
      "inputs": {
        "simulation_requested": false,
        "source_binding": {"event_id": "evt-007", "root_event_id": "evt-007", "payload_sha256": "1111111111111111111111111111111111111111111111111111111111111111"},
        "receipt": {"event_id": "evt-007", "status": "stored", "gate_label": "informative", "memory_revision": 9, "journal_seq": 39, "memory_ids": ["mem-26"], "extraction_incomplete": false, "embedding_pending": false},